{
  "description": "Mock WMS basic outbound fixture.",
  "outbound": {
    "dock_count": 1,
    "inventory": [
      {
        "inventory_id": "mock-inv-a",
        "location_id": "mock-pick-a",
        "quantity": 120,
        "sku_id": "sku-mock-a",
        "status": "available"
      },
      {
        "inventory_id": "mock-inv-b",
        "location_id": "mock-pick-b",
        "quantity": 80,
        "sku_id": "sku-mock-b",
        "status": "available"
      }
    ],
    "orders": [
      {
        "dock_id": "dock-mock-1",
        "order_id": "mock-order-1",
        "pick_location_id": "mock-pick-a",
        "quantity": 6,
        "released_at_ms": 0,
        "sku_id": "sku-mock-a",
        "staging_location_id": "mock-stage-1",
        "warehouse_id": "warehouse-1"
      },
      {
        "dock_id": "dock-mock-1",
        "order_id": "mock-order-2",
        "pick_location_id": "mock-pick-b",
        "quantity": 4,
        "released_at_ms": 90,
        "sku_id": "sku-mock-b",
        "staging_location_id": "mock-stage-1",
        "warehouse_id": "warehouse-1"
      }
    ],
    "process": {
      "dock_travel_duration_ms": 20,
      "load_duration_ms": 70,
      "pick_duration_ms": 45,
      "stage_duration_ms": 35
    },
    "scenario_id": "mock-wms-basic-outbound.outbound",
    "worker_count": 2
  },
  "scenario_id": "mock-wms-basic-outbound",
  "schema_version": "warehouse-scenario.v0",
  "seed": 84
}
